{
  "key": "cosli",
  "short_name": "COSLi",
  "name": "Civilian Open Source License",
  "category": "Free Restricted",
  "owner": "Fieldtracks",
  "homepage_url": "https://cosli.eu/",
  "spdx_license_key": "LicenseRef-scancode-cosli",
  "ignorable_copyrights": [
    "Copyright (c) 2017-2019 The Fieldtracks Project",
    "Copyright (c) The OpenSSL Project"
  ],
  "ignorable_holders": [
    "The Fieldtracks Project",
    "The OpenSSL Project"
  ],
  "ignorable_authors": [
    "the Fieldtracks Project (https://fieldtracks.org/)",
    "the fieldtracks Project (https://www.fieldtracks.org/)"
  ],
  "ignorable_urls": [
    "https://fieldtracks.org/",
    "https://www.fieldtracks.org/"
  ],
  "ignorable_emails": [
    "info@fieldtracks.org"
  ],
  "text": "Civilian Open Source License (COSLi)\n-------------------------------------------------------------------------------\n\nCopyright (c) 2017-2019 The Fieldtracks Project. All rights reserved.\n\nBased on the OpenSSL License // Copyright (c) The OpenSSL Project\n\nRedistribution and use in source and binary forms, with or without\nmodification, are permitted provided that the following conditions\nare met:\n\n1. The software must not be used for millitary purposes. This includes:\n   (i) use in the context of military operations (i.e. trainings, maneuvers,\n   combat), (ii) use by armed forces, private military companies and\n   intelligence services and (iii) use in cooperation with such\n   organisations. Please contact info@fieldtracks.org for:\n   - A written permission in dual-use situations.\n   - Clarification for a specific application, organisation or\n     use-case.\n   - Re-licensing for inclusion in other OpenSource projects (i.e. GPL\n     based ones).\n\n2. Redistributions of source code must retain the above copyright\n   notice, this list of conditions, this restriction on military usage\n   and the following disclaimer.\n\n3. Redistributions in binary form must reproduce the above copyright\n   notice, this list of conditions, this restriction on military usage\n   and the following disclaimer in the documentation and/or other\n   materials provided with the distribution.\n\n4. All advertising materials mentioning features or use of this\n   software must display the following acknowledgment:\n   \"This product includes software developed by the fieldtracks Project\n   (https://www.fieldtracks.org/)\"\n\n5. The name \"Fieldtracks\" must not be used to\n   endorse or promote products derived from this software without\n   prior written permission. For written permission, please contact\n   info@fieldtracks.org.\n\n6. Products derived from this software may not be called \"Fieldtracks\"\n   nor may \"Fieldtracks\" appear in their names without prior written\n   permission of the Fieldtracks Project.\n\n7. Redistributions of any form whatsoever must retain the restriction on\n   military usage and following acknowledgment:\n   \"This product includes software developed by the Fieldtracks Project\n   (https://fieldtracks.org/) - military use is forbidden\"\n\nTHIS SOFTWARE IS PROVIDED BY THE Fieldtracks PROJECT ``AS IS'' AND ANY\nEXPRESSED OR IMPLIED WARRANTIES, INCLUDING, BUT NOT LIMITED TO, THE\nIMPLIED WARRANTIES OF MERCHANTABILITY AND FITNESS FOR A PARTICULAR\nPURPOSE ARE DISCLAIMED.  IN NO EVENT SHALL THE Fieldtracks PROJECT OR\nITS CONTRIBUTORS BE LIABLE FOR ANY DIRECT, INDIRECT, INCIDENTAL,\nSPECIAL, EXEMPLARY, OR CONSEQUENTIAL DAMAGES (INCLUDING, BUT\nNOT LIMITED TO, PROCUREMENT OF SUBSTITUTE GOODS OR SERVICES;\nLOSS OF USE, DATA, OR PROFITS; OR BUSINESS INTERRUPTION)\nHOWEVER CAUSED AND ON ANY THEORY OF LIABILITY, WHETHER IN CONTRACT,\nSTRICT LIABILITY, OR TORT (INCLUDING NEGLIGENCE OR OTHERWISE)\nARISING IN ANY WAY OUT OF THE USE OF THIS SOFTWARE, EVEN IF ADVISED\nOF THE POSSIBILITY OF SUCH DAMAGE. MILITARY USAGE IS FORBIDDEN."
}