{
  "key": "ej-technologies-eula",
  "short_name": "ej-technologies EULA",
  "name": "ej-technologies EULA",
  "category": "Commercial",
  "owner": "ej-technologies",
  "homepage_url": "http://www.ej-technologies.com/buy/jprofiler/jprofiler_license.html",
  "spdx_license_key": "LicenseRef-scancode-ej-technologies-eula",
  "text_urls": [
    "http://www.ej-technologies.com/buy/jprofiler/jprofiler_license.html"
  ],
  "ignorable_urls": [
    "http://www.ej-technologies.com/",
    "http://www.ej-technologies.com/buy/jprofiler/jprofiler_license.html"
  ],
  "ignorable_emails": [
    "info@ej-technologies.com"
  ],
  "text": "ej-technologies-EULA\nhttp://www.ej-technologies.com/buy/jprofiler/jprofiler_license.html\n\nIMPORTANT-READ CAREFULLY: This End-User License Agreement (\"EULA\") is a legal\nagreement between you (either an individual or a single legal entity) and\nej-technologies GmbH (ej-technologies), which covers your use of JProfiler and\nrelated software components (\"Software Product\" or JProfiler).\n\nA software license and a license key or serial number (\"Software Product\nLicense\"), issued only by ej-technologies or its authorized agents to a\ndesignated user may be required according to the following agreement.\n\nIf you do not agree to the terms of this EULA, then do not download, install\nor use the Software Product or the Software Product License. By explicitly\naccepting this EULA you are acknowledging and agreeing to be bound by the\nfollowing terms:\n\n1. GRANT OF LICENSE\n\nThe Software Product is owned by ej-technologies. It is licensed, not sold.\nThe Software Product is protected by copyright laws and international\ncopyright treaties, as well as other intellectual property laws and treaties.\nej-technologies reserves all intellectual property rights, including\ncopyrights and trademark rights.\n\nAccording to your order, ej-technologies grants you a non-exclusive,\nnon-transferable license to use the Software Product under certain obligations\nand limited rights as set forth in this agreement:\n\n\n- SINGLE-USER LICENSE: ej-technologies grants the non-exclusive,\n  non-transferable right for a single user to use this Software Product. Each\n  additional user of the Software Product requires an additional Software\n  Product License. You may use each Software Product License on more than one\n  computer system, as long as it is always used by the same user. You may\n  transfer the Software Product License to a different user only if you remove\n  all previous installations completely.\n\n- SINGLE-MACHINE LICENSE: ej-technologies grants the non-exclusive,\n  non-transferable right to install this Software Product on a single computer\n  system. Each additional installation of the Software Product requires an\n  additional Software Product License. You may transfer the Software Product\n  License to a different computer system only if you remove the previous\n  installation completely.\n\n- FLOATING LICENSE: ej-technologies grants the non-exclusive, non-transferable\n  right to install this Software Product on multiple computer systems. An\n  arbitrary number of users may install the Software Product, but the maximum\n  number of concurrently running instances is limited according to your order.\n  Each additional concurrent user of the Software Product requires an\n  additional Software Product License. ej-technologies provides you with a\n  License Server that manages the use of floating licenses. You agree to be\n  bound by the separate license agreement of the license server.\n\n- SITE LICENSE: ej-technologies grants the non-exclusive, non-transferable\n  right to install and use this Software Product on an arbitrary number of\n  computer systems on one site.\n\n\nej-technologies issues a Software Product License that allows you to use the\nSoftware Product accordingly. You may not disclose the Software Product\nLicense in any way.\n\nBackup Copy: You may make copies of the Software Product and the Software\nProduct License as reasonably necessary for the use authorized above,\nincluding as needed for backup and/or archival purposes. No other copies may\nbe made. Each copy must reproduce all copyright and other proprietary rights\nnotices on or in the Software Product.\n\n2. LICENSE TO DISTRIBUTE REDISTRIBUTABLE FILES\n\nej-technologies grants you a non-exclusive, non-transferable, limited license\nto distribute all parts of JProfiler that are required for running the\nprofiling agent provided that:\n\n- You remove your license key from the redistributed configuration file\n  (\"config.xml\")\n\n- You do not remove or alter any proprietary legends or notices contained in\n  or on the redistributables\n\n- You only distribute the redistributables with a license agreement that\n  protects ej-technologies' interests consistently with the terms contained in\n  this agreement\n\n- You agree to defend and indemnify ej-technologies from and against any\n  damages, costs, liabilities, settlement amounts and/or expenses (including\n  attorneys' fees) incurred in connection with any claim, lawsuit or action by\n  any third party that arises or results from the use or distribution of any\n  redistributable files.\n\n3. RESTRICTED USE FOR EVALUATION\n\nThis Software Product can be used in conjunction with a free evaluation\nSoftware Product License. If you are using such an evaluation Software Product\nLicense, you may use the Software Product only to evaluate its suitability for\npurchase. Evaluation Software has been limited in some way either through\ntimeouts, restricted use or evaluation warnings. ej-technologies bears no\nliability for any damages resulting from use (or attempted use after\nexpiration) of the software product, and has no duty to provide any support\nbefore or after the expiration date of an evaluation license.\n\n4. SUPPORT SERVICES\n\nej-technologies may provide you with support services related to the Software\nProduct according to your order. Use of any such support services is governed\nby policies described on ej-technologies' web site\n(http://www.ej-technologies.com).\n\nAny supplemental software code or related materials that ej-technologies\nprovides to you as part of the support services, in periodic updates to the\nSoftware Product or otherwise, is to be considered part of the Software\nProduct and is subject to the terms and conditions of this EULA.\n\nWith respect to any technical information you provide to ej-technologies as\npart of the support services, ej-technologies may use such information for its\nbusiness purposes without restriction, including for product support and\ndevelopment. ej-technologies will not use such technical information in a form\nthat personally identifies you without first obtaining your permission.\n\n5. RESTRICTIONS\n\nYou may not use, copy, or distribute the Software Product, except as granted\nby this EULA, without written authorization from ej-technologies.\n\nYou may not tamper with, alter, or use the Software Product in a way that\ndisables, circumvents, or otherwise defeats its built-in licensing\nverification and enforcement capabilities.\n\nYou may not remove or alter any trademark, logo, copyright or other\nproprietary notice, legend, symbol or label in the Software Product. You may\nnot modify or create derivative copies of the Software Product License.\n\nYou may not reverse engineer, decompile, defeat license encryption mechanisms,\nor disassemble the Software Product or Software Product License except and\nonly to the extent that such activity is expressly permitted by applicable law\nnotwithstanding this limitation. You may not rent, lease, lend, or in any way\ndistribute or transfer any rights in this EULA or the Software Product to\nthird parties without ej-technologies' written approval, and subject to\nwritten agreement by the recipient of the terms of this EULA.\n\nThe Software Product is not fault-tolerant and is not designed, manufactured\nor intended for use or resale as on-line control equipment in hazardous\nenvironments requiring fail-safe performance, in which the failure of the\nSoftware Product, or any software, tool, process, or service that was\ndeveloped using the Software Product, could lead directly to death, personal\ninjury, or severe physical or environmental damage (\"High Risk Activities\").\nAccordingly, ej-technologies and its suppliers and licensors specifically\ndisclaim any express or implied warranty of fitness for High Risk Activities.\nYou agree that ej-technologies and its suppliers and licensors will not be\nliable for any claims or damages arising from the use of the Software Product,\nor any software, tool, process, or service that was developed using the\nSoftware Product, in such applications.\n\n6. THIRD PARTY RIGHTS\n\nAny software provided along with the Software Product that is associated with\na separate license agreement is licensed to you under the terms of that\nlicense agreement. This license does not apply to those portions of the\nSoftware Product. Copies of these third party licenses are included in all\ncopies of the Software Product.\n\n7. LIMITED WARRANTY\n\nYou have ensured with the above mentioned evaluation version that the Software\nProduct works according to your requirements and the advertised features.\nej-technologies disclaims all warranties for deficiencies that are reasonably\ndiscoverable with the evaluation version of the Software Product. You\nacknowledge that software cannot be completely error-free. ej-technologies\ndisclaims all warranties regarding non-severe deviations of the advertised\nfeatures of the Software Product.\n\nThe limitation period is one year, if not otherwise regulated by law, and\nstarts with the service provision.\n\nTo the maximum extent permitted by applicable law, ej-technologies and its\nthird party suppliers and licensors disclaim all other representations,\nwarranties, and conditions, expressed, implied, statutory, or otherwise,\nincluding, but not limited to, implied warranties or conditions of\nmerchantability, satisfactory quality, fitness for a particular purpose,\ntitle, and non-infringement. The entire risk arising out of use or performance\nof the software product remains with you.\n\n8. LIMITATION OF LIABILITY\n\nThis limitation of liability is to the maximum extent permitted by applicable\nlaw. ej-technologies is liable to indemnity only according to the following\nterms:\n\nej-technologies is fully liable in case of intention, gross negligence, loss\nfrom physical injury, severe organizational failure or in case of an\nacceptance of guarantee.\n\nLiability for slight negligence is limited to material breach of contractual\nobligations and in that case to the typically predictable loss. Any further\nliability is excluded. Contributory negligence of the licensee and other\nparties will be taken into account. Any liability under the terms of product\nliability laws remains unaffected.\n\nYou agree to ensure that a data backup is performed on all computers that the\nSoftware Product or redistributable parts of it are used on. In case of loss\nof data, liability is limited to the cost that would arise in the case where a\nproper backup has been performed.\n\nThe limitation period is one year, if not otherwise regulated by law, and\nstarts with the service provision.\n\nAny limitation of ej-technologies' liability also applies to your staff,\nagents and associated companies.\n\n9. GENERAL\n\nej-technologies may terminate this EULA if you fail to comply with any term or\ncondition of this EULA. In such event, you must destroy all copies of the\nSoftware Product and Software Product Licenses.\n\nThis EULA is governed by the laws of Germany. Exclusive jurisdiction and place\nof performance is Muenchen, Germany, as long as permitted by applicable law.\nThe United Nations Convention for the International Sale of Goods shall not\napply.\n\nThis EULA is the entire agreement between ej-technologies and you, and\nsupersedes any other communications or advertising with respect to the\nSoftware Product; this EULA may be modified only by written agreement signed\nby authorized representatives of you and ej-technologies.\n\nIf any provision of this EULA is held invalid, the remainder of this EULA\nshall continue in full force and effect.\n\nAll rights not expressly granted in this agreement are retained by\nej-technologies.\n\n10. CONTACT INFORMATION\n\nIf you have any questions about this EULA, or if you want to contact\nej-technologies for any reason, please direct correspondence to\nej-technologies GmbH, Claude-Lorrain-Str. 7, D-81543 Muenchen, Germany, or\nsend email to info@ej-technologies.com."
}