{
  "key": "freemarker",
  "short_name": "FreeMarker License",
  "name": "FreeMarker License",
  "category": "Permissive",
  "owner": "freemarker.org",
  "homepage_url": "http://freemarker.org/LICENSE.txt",
  "spdx_license_key": "LicenseRef-scancode-freemarker",
  "text_urls": [
    "http://freemarker.org/LICENSE.txt",
    "http://freemarker.org/docs/app_license.html"
  ],
  "ignorable_copyrights": [
    "Copyright (c) 2003 The Visigoth Software Society"
  ],
  "ignorable_holders": [
    "The Visigoth Software Society"
  ],
  "ignorable_authors": [
    "the Visigoth Software Society (http://www.visigoths.org/)"
  ],
  "ignorable_urls": [
    "http://www.apache.org/licenses/LICENSE-2.0",
    "http://www.visigoths.org/"
  ],
  "ignorable_emails": [
    "visigoths@visigoths.org"
  ],
  "text": "FreeMarker License\n\nFreeMarker 1.x was released under the LGPL license. Later, by community\nconsensus, we have switched over to a BSD-style license. As of FreeMarker\n2.2pre1, the original author, Benjamin Geer, has relinquished the copyright in\nbehalf of Visigoth Software Society. The current copyright holder is the\nVisigoth Software Society.\n\n------------------------------------------------------------------------------\nCopyright (c) 2003 The Visigoth Software Society. All rights reserved.\n\nRedistribution and use in source and binary forms, with or without\nmodification, are permitted provided that the following conditions are met:\n\n1.  Redistributions of source code must retain the above copyright notice,\n    this list of conditions and the following disclaimer.\n\n2.  The end-user documentation included with the redistribution, if any, must\n    include the following acknowlegement:\n      \"This product includes software developed by the \n      Visigoth Software Society (http://www.visigoths.org/).\"\n    Alternately, this acknowlegement may appear in the software itself, if and\n    wherever such third-party acknowlegements normally appear.\n\n3.  Neither the name \"FreeMarker\", \"Visigoth\", nor any of the names of the\n    project contributors may be used to endorse or promote products derived\n    from this software without prior written permission. For written\n    permission, please contact visigoths@visigoths.org.\n\n4.  Products derived from this software may not be called \"FreeMarker\" or\n    \"Visigoth\" nor may \"FreeMarker\" or \"Visigoth\" appear in their names\n    without prior written permission of the Visigoth Software Society.\n\nTHIS SOFTWARE IS PROVIDED ``AS IS'' AND ANY EXPRESSED OR IMPLIED WARRANTIES,\nINCLUDING, BUT NOT LIMITED TO, THE IMPLIED WARRANTIES OF MERCHANTABILITY AND\nFITNESS FOR A PARTICULAR PURPOSE ARE DISCLAIMED. IN NO EVENT SHALL THE\nVISIGOTH SOFTWARE SOCIETY OR ITS CONTRIBUTORS BE LIABLE FOR ANY DIRECT,\nINDIRECT, INCIDENTAL, SPECIAL, EXEMPLARY, OR CONSEQUENTIAL DAMAGES (INCLUDING,\nBUT NOT LIMITED TO, PROCUREMENT OF SUBSTITUTE GOODS OR SERVICES; LOSS OF USE,\nDATA, OR PROFITS; OR BUSINESS INTERRUPTION) HOWEVER CAUSED AND ON ANY THEORY\nOF LIABILITY, WHETHER IN CONTRACT, STRICT LIABILITY, OR TORT (INCLUDING\nNEGLIGENCE OR OTHERWISE) ARISING IN ANY WAY OUT OF THE USE OF THIS SOFTWARE,\nEVEN IF ADVISED OF THE POSSIBILITY OF SUCH DAMAGE.\n------------------------------------------------------------------------------\n\nThis software consists of voluntary contributions made by many individuals on\nbehalf of the Visigoth Software Society. For more information on the Visigoth\nSoftware Society, please see http://www.visigoths.org/\n\n------------------------------------------------------------------------------\n\nFREEMARKER SUBCOMPONENTS UNDER DIFFERENT LICENSE:\n\nFreeMarker includes a number of subcomponents that are licensed by the Apache\nSoftware Foundation under the Apache License, Version 2.0. Your use of these\nsubcomponents is subject to the terms and conditions of the Apache License,\nVersion 2.0. You may obtain a copy of the License at\n\n    http://www.apache.org/licenses/LICENSE-2.0\n    \nThe subcomponents under this licence are the following files, which are\nincluded both in freemarker.jar and in the source code:\n  \n    freemarker/ext/jsp/web-app_2_2.dtd\n    freemarker/ext/jsp/web-app_2_3.dtd\n    freemarker/ext/jsp/web-app_2_4.xsd\n    freemarker/ext/jsp/web-app_2_5.xsd\n    freemarker/ext/jsp/web-jsptaglibrary_1_1.dtd\n    freemarker/ext/jsp/web-jsptaglibrary_1_2.dtd\n    freemarker/ext/jsp/web-jsptaglibrary_2_0.xsd\n    freemarker/ext/jsp/web-jsptaglibrary_2_1.xsd"
}