{
  "key": "ftpbean",
  "short_name": "FtpBean License",
  "name": "FtpBean License",
  "category": "Proprietary Free",
  "owner": "Calvin Tai",
  "homepage_url": "http://www.geocities.com/SiliconValley/Code/9129/javabean/ftpbean",
  "spdx_license_key": "LicenseRef-scancode-ftpbean",
  "ignorable_copyrights": [
    "Copyright 1999 Calvin Tai"
  ],
  "ignorable_holders": [
    "Calvin Tai"
  ],
  "ignorable_urls": [
    "http://www.geocities.com/SiliconValley/Code/9129/javabean/ftpbean"
  ],
  "ignorable_emails": [
    "citidancer@hongkong.com"
  ],
  "text": "FtpBean                      Version 1.4.2\nCopyright 1999 Calvin Tai\nE-mail: citidancer@hongkong.com\nURL: http://www.geocities.com/SiliconValley/Code/9129/javabean/ftpbean\n\nCOPYRIGHT NOTICE\nCopyright 1999 Calvin Tai All Rights Reserved.\n\nFtpBean may be modified and used in any application free of charge by\nanyone so long as this copyright notice and the comments above remain\nintact. By using this code you agree to indemnify Calvin Tai from any\nliability that might arise from it's use.\n\nSelling the code for this java bean alone is expressly forbidden.\nIn other words, please ask first before you try and make money off of\nthis java bean as a standalone application.\n\nObtain permission before redistributing this software over the Internet or\nin any other medium.  In all cases copyright and header must remain intact."
}