{
  "key": "libmib",
  "short_name": "LibMib License",
  "name": "LibMib License",
  "category": "Permissive",
  "owner": "MIB Software",
  "spdx_license_key": "LicenseRef-scancode-libmib",
  "ignorable_copyrights": [
    "Copyright 1998 Forrest J. Cavalier III"
  ],
  "ignorable_holders": [
    "Forrest J. Cavalier III"
  ],
  "ignorable_urls": [
    "http://www.mibsoftware.com/",
    "http://www.mibsoftware.com/libmib/",
    "http://www.opensource.org/"
  ],
  "text": "- - - - - - - - - - - - Copyright Notice - - - - - - - - - - - -\n\nCopyright 1998 Forrest J. Cavalier III\n\nSee http://www.mibsoftware.com/libmib/ for documentation, original copies, and information on supported, industrial quality (non-experimental) versions appropriate for commercial use. This version is considered experimental.\n\nThis software is provided by Forrest J. Cavalier III, d-b-a Mib Software, under the license which follows, which is believed to meet the open-source definition, version 1.0 at http://www.opensource.org\n\nWe would appreciate that you notify us of defect discoveries and enhancements so that others can benefit from work on open-source software.\n\nForrest J. Cavalier III, Mib Software http://www.mibsoftware.com We customize and extend reusable and open software.\n\n- - - - - - - - - - - - - License - - - - - - - - - - - - - - - - -\n\nPermission is hereby granted, free of charge, to any person obtaining a copy of this software (the \"Software\"), to deal in the Software without restriction, including the rights to use, copy, modify, merge,publish, distribute, sublicense, and/or sell copies of the Software, and to permit persons to whom the Software is furnished to do so,subject to the following conditions.\n\n1. The above copyright notice and this permission notice shall be included in the source code of all copies or substantial portions of the Software.\n\n2. Modifications to the Software may be created.\nUnless other licensing agreements are made in writing, these conditions apply when distributing source code.\n\na) When source code of the Software is distributed, it shall be in its \"pristine\", unmodified form.\nand\nb) Modifications to the Software which are distributed as source code shall be distributed only as \"patch files.\"\nand\nc) Modified works that are distributed shall be named differently than the original.\n\nContact the author to arrange other terms.\n\n3. THE SOFTWARE IS PROVIDED \"AS IS\", WITHOUT WARRANTY OF ANY KIND, EXPRESS OR IMPLIED, INCLUDING BUT NOT LIMITED TO THE WARRANTIES OF MERCHANTABILITY, FITNESS FOR A PARTICULAR PURPOSE AND NONINFRINGEMENT. IN NO EVENT SHALL THE AUTHORS OR COPYRIGHT HOLDERS BE LIABLE FOR ANY CLAIM, DAMAGES OR OTHER LIABILITY, WHETHER IN AN ACTION OF CONTRACT,TORT OR OTHERWISE, ARISING FROM, OUT OF OR IN CONNECTION WITH THE SOFTWARE OR THE USE OR OTHER DEALINGS IN THE SOFTWARE. */"
}