{
  "key": "luxi",
  "short_name": "Bigelow & Holmes Luxi fonts license",
  "name": "Bigelow & Holmes Luxi fonts license",
  "category": "Proprietary Free",
  "owner": "Bigelow & Holmes",
  "spdx_license_key": "LicenseRef-scancode-luxi",
  "ignorable_copyrights": [
    "copyright (c) 2001 by Bigelow & Holmes Inc.",
    "copyright (c) 2001 by URW++ GmbH."
  ],
  "ignorable_holders": [
    "Bigelow & Holmes Inc.",
    "URW++ GmbH."
  ],
  "ignorable_emails": [
    "design@bigelowandholmes.com",
    "info@urwpp.de"
  ],
  "text": "Luxi fonts copyright (c) 2001 by Bigelow & Holmes Inc. Luxi font instruction\ncode copyright (c) 2001 by URW++ GmbH. All Rights Reserved. Luxi is a regis-\ntered trademark of Bigelow & Holmes Inc.\n\nPermission is hereby granted, free of charge, to any person obtaining a copy\nof these Fonts and associated documentation files (the \"Font Software\"), to\ndeal in the Font Software, including without limitation the rights to use,\ncopy, merge, publish, distribute, sublicense, and/or sell copies of the Font\nSoftware, and to permit persons to whom the Font Software is furnished to do\nso, subject to the following conditions:\n\nThe above copyright and trademark notices and this permission notice shall be\nincluded in all copies of one or more of the Font Software.\n\nThe Font Software may not be modified, altered, or added to, and in particu-\nlar the designs of glyphs or characters in the Fonts may not be modified nor\nmay additional glyphs or characters be added to the Fonts. This License\nbecomes null and void when the Fonts or Font Software have been modified.\n\nTHE FONT SOFTWARE IS PROVIDED \"AS IS\", WITHOUT WARRANTY OF ANY KIND, EXPRESS\nOR IMPLIED, INCLUDING BUT NOT LIMITED TO ANY WARRANTIES OF MERCHANTABILITY,\nFITNESS FOR A PARTICULAR PURPOSE AND NONINFRINGEMENT OF COPYRIGHT, PATENT,\nTRADEMARK, OR OTHER RIGHT.  IN NO EVENT SHALL BIGELOW & HOLMES INC. OR URW++\nGMBH. BE LIABLE FOR ANY CLAIM, DAMAGES OR OTHER LIABILITY, INCLUDING ANY GEN-\nERAL, SPECIAL, INDIRECT, INCIDENTAL, OR CONSEQUENTIAL DAMAGES, WHETHER IN AN\nACTION OF CONTRACT, TORT OR OTHERWISE, ARISING FROM, OUT OF THE USE OR\nINABILITY TO USE THE FONT SOFTWARE OR FROM OTHER DEALINGS IN THE FONT SOFT-\nWARE.\n\nExcept as contained in this notice, the names of Bigelow & Holmes Inc. and\nURW++ GmbH. shall not be used in advertising or otherwise to promote the\nsale, use or other dealings in this Font Software without prior written\nauthorization from Bigelow & Holmes Inc. and URW++ GmbH.\n\nFor further information, contact:\n\ninfo@urwpp.de or design@bigelowandholmes.com"
}