{
  "key": "mx4j",
  "short_name": "MX4J License 1.0",
  "name": "MX4J License 1.0",
  "category": "Permissive",
  "owner": "MX4J Project",
  "spdx_license_key": "LicenseRef-scancode-mx4j",
  "other_urls": [
    "http://mx4j.sourceforge.net"
  ],
  "ignorable_copyrights": [
    "Copyright (c) by the MX4J contributors"
  ],
  "ignorable_holders": [
    "the MX4J contributors"
  ],
  "ignorable_authors": [
    "the MX4J project (http://mx4j.sourceforge.net)"
  ],
  "ignorable_urls": [
    "http://mx4j.sourceforge.net/"
  ],
  "ignorable_emails": [
    "biorn_steedom@users.sourceforge.net"
  ],
  "text": "The MX4J License, Version 1.0\n\nCopyright (c) by the MX4J contributors.  All rights reserved.\n\nRedistribution and use in source and binary forms, with or without\nmodification, are permitted provided that the following conditions\nare met:\n\n1. Redistributions of source code must retain the above copyright\n   notice, this list of conditions and the following disclaimer.\n\n2. Redistributions in binary form must reproduce the above copyright\n   notice, this list of conditions and the following disclaimer in\n   the documentation and/or other materials provided with the\n   distribution.\n\n3. The end-user documentation included with the redistribution,\n   if any, must include the following acknowledgment:\n      \"This product includes software developed by the\n       MX4J project (http://mx4j.sourceforge.net).\"\n   Alternately, this acknowledgment may appear in the software itself,\n   if and wherever such third-party acknowledgments normally appear.\n\n4. The name \"MX4J\" must not be used to endorse or promote\n   products derived from this software without prior written\n   permission.\n   For written permission, please contact biorn_steedom@users.sourceforge.net\n\n5. Products derived from this software may not be called \"MX4J\",\n   nor may \"MX4J\" appear in their name, without prior written\n   permission of Simone Bordet.\n\nTHIS SOFTWARE IS PROVIDED ``AS IS'' AND ANY EXPRESSED OR IMPLIED\nWARRANTIES, INCLUDING, BUT NOT LIMITED TO, THE IMPLIED WARRANTIES\nOF MERCHANTABILITY AND FITNESS FOR A PARTICULAR PURPOSE ARE\nDISCLAIMED.  IN NO EVENT SHALL THE MX4J CONTRIBUTORS\nBE LIABLE FOR ANY DIRECT, INDIRECT, INCIDENTAL,\nSPECIAL, EXEMPLARY, OR CONSEQUENTIAL DAMAGES (INCLUDING, BUT NOT\nLIMITED TO, PROCUREMENT OF SUBSTITUTE GOODS OR SERVICES; LOSS OF\nUSE, DATA, OR PROFITS; OR BUSINESS INTERRUPTION) HOWEVER CAUSED AND\nON ANY THEORY OF LIABILITY, WHETHER IN CONTRACT, STRICT LIABILITY,\nOR TORT (INCLUDING NEGLIGENCE OR OTHERWISE) ARISING IN ANY WAY OUT\nOF THE USE OF THIS SOFTWARE, EVEN IF ADVISED OF THE POSSIBILITY OF\nSUCH DAMAGE.\n====================================================================\n\nThis software consists of voluntary contributions made by many\nindividuals on behalf of the MX4J project.  For more information on\nMX4J, please see\n<http://mx4j.sourceforge.net>."
}