{
  "key": "nrl",
  "short_name": "NRL License",
  "name": "NRL License",
  "category": "Permissive",
  "owner": "NRL",
  "homepage_url": "http://web.mit.edu/network/isakmp/nrllicense.html",
  "spdx_license_key": "NRL",
  "ignorable_copyrights": [
    "copyright by The Regents of the University of California"
  ],
  "ignorable_holders": [
    "The Regents of the University of California"
  ],
  "ignorable_authors": [
    "the University of California, Berkeley and its contributors"
  ],
  "text": "NRL License\nCOPYRIGHT NOTICE\n\nAll of the documentation and software included in this software distribution from the US Naval Research Laboratory (NRL) are copyrighted by their respective developers.\n\nPortions of the software are derived from the Net/2 and 4.4-Lite Berkeley Software Distributions (BSD) of the University of California at Berkeley and those portions are copyright by The Regents of the University of California. All Rights Reserved. The UC Berkeley Copyright and License agreement is binding on those portions of the software. In all cases, the NRL developers have retained the original UC Berkeley copyright and license notices in the respective files in accordance with the UC Berkeley copyrights and license.\n\nPortions of this software and documentation were developed at NRL by various people. Those developers have each copyrighted the portions that they developed at NRL and have assigned All Rights for those portions to NRL. Outside the USA, NRL has copyright on some of the software developed at NRL. The affected files all contain specific copyright notices and those notices must be retained in any derived work.\n\nNRL LICENSE\n\nNRL grants permission for redistribution and use in source and binary forms, with or without modification, of the software and documentation created at NRL provided that the following conditions are met:\n\n1. All terms of the UC Berkeley copyright and license must be followed. \n2. Redistributions of source code must retain the above copyright notice, this list of conditions and the following disclaimer. \n3. Redistributions in binary form must reproduce the above copyright notice, this list of conditions and the following disclaimer in the documentation and/or other materials provided with the distribution. \n4. All advertising materials mentioning features or use of this software must display the following acknowledgements:\n\nThis product includes software developed by the University of California, Berkeley and its contributors.\n\nThis product includes software developed at the Information Technology Division, US Naval Research Laboratory.\n\n5. Neither the name of the NRL nor the names of its contributors may be used to endorse or promote products derived from this software without specific prior written permission.\n\nTHE SOFTWARE PROVIDED BY NRL IS PROVIDED BY NRL AND CONTRIBUTORS ``AS IS'' AND ANY EXPRESS OR IMPLIED WARRANTIES, INCLUDING, BUT NOT LIMITED TO, THE IMPLIED WARRANTIES OF MERCHANTABILITY AND FITNESS FOR A PARTICULAR PURPOSE ARE DISCLAIMED. IN NO EVENT SHALL NRL OR CONTRIBUTORS BE LIABLE FOR ANY DIRECT, INDIRECT, INCIDENTAL, SPECIAL, EXEMPLARY, OR CONSEQUENTIAL DAMAGES (INCLUDING, BUT NOT LIMITED TO, PROCUREMENT OF SUBSTITUTE GOODS OR SERVICES; LOSS OF USE, DATA, OR PROFITS; OR BUSINESS INTERRUPTION) HOWEVER CAUSED AND ON ANY THEORY OF LIABILITY, WHETHER IN CONTRACT, STRICT LIABILITY, OR TORT (INCLUDING NEGLIGENCE OR OTHERWISE) ARISING IN ANY WAY OUT OF THE USE OF THIS SOFTWARE, EVEN IF ADVISED OF THE POSSIBILITY OF SUCH DAMAGE.\n\nThe views and conclusions contained in the software and documentation are those of the authors and should not be interpreted as representing official policies, either expressed or implied, of the US Naval Research Laboratory (NRL)."
}