{
  "key": "owtchart",
  "short_name": "OWTChart License",
  "name": "OWTChart License",
  "category": "Permissive",
  "owner": "Unspecified",
  "notes": "composite",
  "spdx_license_key": "LicenseRef-scancode-owtchart",
  "minimum_coverage": 85,
  "ignorable_copyrights": [
    "Copyright (c) 1998, 1999, Daniel Morissette",
    "Portions copyright 1994, 1995, 1996, 1997, 1998, by Cold Spring Harbor Laboratory",
    "Portions copyright 1996, 1997, 1998, by Boutell.Com, Inc.",
    "copyright 1990, 1991, 1993, by David Koblas (koblas@netcom.com)",
    "copyright 1998, by Hutchison Avenue Software Corporation"
  ],
  "ignorable_holders": [
    "Boutell.Com, Inc.",
    "Cold Spring Harbor Laboratory",
    "Daniel Morissette",
    "David Koblas",
    "Hutchison Avenue Software Corporation"
  ],
  "ignorable_authors": [
    "Daniel Morissette (danmo@videotron.ca)"
  ],
  "ignorable_emails": [
    "brv@fred.net",
    "danmo@videotron.ca",
    "koblas@netcom.com"
  ],
  "text": "OWTChart License\n\nCopyright and License Terms\n\nOWTChart is Open Source, which means that it can be used freely, for\npersonnal or commercial application, as long as the authors' Copyright\nand Distribution terms are respected. It is based on the GDChart\nlibrary, which in turn uses Boutell.com's GD (GifDraw) library, so this\nmeans 3 sets of Copyright and Distribution terms to follow.\n\nThe application part of OWTChart was developed by Daniel Morissette\n(danmo@videotron.ca), and part of it was done under contract with Health\nCanada. It is covered by the following Copyright and Distribution terms:\nCopyright (c) 1998, 1999, Daniel Morissette\n\nPermission is hereby granted, free of charge, to any person obtaining a\ncopy of this software and associated documentation files (the\n\"Software\"), to deal in the Software without restriction, including\nwithout limitation the rights to use, copy, modify, merge, publish,\ndistribute, sublicense, and/or sell copies of the Software, and to\npermit persons to whom the Software is furnished to do so, subject to\nthe following conditions:\n\nThe above copyright notice and this permission notice shall be included\nin all copies or substantial portions of the Software. THE SOFTWARE IS\nPROVIDED \"AS IS\", WITHOUT WARRANTY OF ANY KIND, EXPRESS OR IMPLIED,\nINCLUDING BUT NOT LIMITED TO THE WARRANTIES OF MERCHANTABILITY, FITNESS\nFOR A PARTICULAR PURPOSE AND NONINFRINGEMENT. IN NO EVENT SHALL THE\nAUTHORS OR COPYRIGHT HOLDERS BE LIABLE FOR ANY CLAIM, DAMAGES OR OTHER\nLIABILITY, WHETHER IN AN ACTION OF CONTRACT, TORT OR OTHERWISE, ARISING\nFROM, OUT OF OR IN CONNECTION WITH THE SOFTWARE OR THE USE OR OTHER\nDEALINGS IN THE SOFTWARE.\n\nThe underlying GDChart library comes with the following Copyright notice\nfrom its author, Bruce Verderaime (brv@fred.net): GDChart is free for\nuse in your applications and for chart generation. YOU MAY NOT re-\ndistribute or represent the code as your own. Any re-distributions of\nthe code MUST reference the author, and include any and all original\ndocumentaion.\n\nIOW: Use it. Don't plagiarize it!\n\nFinally, the GD (GifDraw) library comes with the following Copyright\nnotices: Portions copyright 1994, 1995, 1996, 1997, 1998, by Cold Spring\nHarbor Laboratory. Funded under Grant P41-RR02188 by the National\nInstitutes of Health.\n\nPortions copyright 1996, 1997, 1998, by Boutell.Com, Inc. GIF\ndecompression code copyright 1990, 1991, 1993, by David Koblas\n(koblas@netcom.com). Non-LZW-based GIF compression code copyright 1998,\nby Hutchison Avenue Software Corporation. \n\nPermission has been granted to copy and distribute gd in any context,\nincluding a commercial application, provided that this notice is present\nin user-accessible supporting documentation. This does not affect your\nownership of the derived work itself, and the intent is to assure proper\ncredit for the authors of gd, not to interfere with your productive use\nof gd. If you have questions, ask. \"Derived works\" includes all programs\nthat utilize the library. Credit must be given in user- accessible\ndocumentation. Permission to use, copy, modify, and distribute this\nsoftware and its documentation for any purpose and without fee is hereby\ngranted, provided that the above copyright notice appear in all copies\nand that both that copyright notice and this permission notice appear in\nsupporting documentation. This software is provided \"as is\" without\nexpress or implied warranty."
}