{
  "key": "phorum-2.0",
  "short_name": "Phorum License 2.0",
  "name": "Phorum License 2.0",
  "category": "Permissive",
  "owner": "Phorum",
  "homepage_url": "http://www.phorum.org/license.txt",
  "spdx_license_key": "LicenseRef-scancode-phorum-2.0",
  "text_urls": [
    "http://www.phorum.org/license.txt"
  ],
  "other_urls": [
    "http://phorum.org/"
  ],
  "minimum_coverage": 80,
  "ignorable_copyrights": [
    "Copyright (c) 2001 The Phorum Development Team",
    "copyright (c) 2000 The Apache Software Foundation"
  ],
  "ignorable_holders": [
    "The Apache Software Foundation",
    "The Phorum Development Team"
  ],
  "ignorable_authors": [
    "the Phorum Development Team (http://phorum.org/)"
  ],
  "ignorable_urls": [
    "http://phorum.org/",
    "http://www.apache.org/"
  ],
  "ignorable_emails": [
    "core@phorum.org"
  ],
  "text": "The Phorum License 2.0.\n\nCopyright (c) 2001 The Phorum Development Team.  All rights\nreserved.\n\nRedistribution and use in source and binary forms, with or without\nmodification, are permitted provided that the following conditions\nare met:\n\n1. Redistributions of source code must retain the above copyright\n   notice, this list of conditions and the following disclaimer.\n\n2. Redistributions in binary form must reproduce the above copyright\n   notice, this list of conditions and the following disclaimer in\n   the documentation and/or other materials provided with the\n   distribution.\n\n3. The end-user documentation included with the redistribution,\n   if any, must include the following acknowledgment:\n      \"This product includes software developed by the\n       Phorum Development Team (http://phorum.org/).\"\n   Alternately, this acknowledgment may appear in the software itself,\n   if and wherever such third-party acknowledgments normally appear.\n\n4. The names \"Phorum\" and \"Phorum Development Team\" must\n   not be used to endorse or promote products derived from this\n   software without prior written permission. For written\n   permission, please contact core@phorum.org.\n\n5. Products derived from this software may not be called \"Phorum\",\n   nor may \"Phorum\" appear in their name, without prior written\n   permission of the Phorum Development Team.\n\nTHIS SOFTWARE IS PROVIDED ``AS IS'' AND ANY EXPRESSED OR IMPLIED\nWARRANTIES, INCLUDING, BUT NOT LIMITED TO, THE IMPLIED WARRANTIES\nOF MERCHANTABILITY AND FITNESS FOR A PARTICULAR PURPOSE ARE\nDISCLAIMED.  IN NO EVENT SHALL THE PHORUM DEVELOPMENT TEAM OR\nITS CONTRIBUTORS BE LIABLE FOR ANY DIRECT, INDIRECT, INCIDENTAL,\nSPECIAL, EXEMPLARY, OR CONSEQUENTIAL DAMAGES (INCLUDING, BUT NOT\nLIMITED TO, PROCUREMENT OF SUBSTITUTE GOODS OR SERVICES; LOSS OF\nUSE, DATA, OR PROFITS; OR BUSINESS INTERRUPTION) HOWEVER CAUSED AND\nON ANY THEORY OF LIABILITY, WHETHER IN CONTRACT, STRICT LIABILITY,\nOR TORT (INCLUDING NEGLIGENCE OR OTHERWISE) ARISING IN ANY WAY OUT\nOF THE USE OF THIS SOFTWARE, EVEN IF ADVISED OF THE POSSIBILITY OF\nSUCH DAMAGE.\n====================================================================\n\nThis software consists of voluntary contributions made by many\nindividuals on behalf of the Phorum Development Team.  For more\ninformation on Phorum , please see\n<http://phorum.org/>.\n\nThis license is based on The Apache Software License Version 1.1.\nOnly the names, email addresses and urls were changed.\nPermission was granted from The Apache Software Foundation to use\ntheir license.\n\nThe original version of the license is copyright (c) 2000 The Apache\nSoftware Foundation. All rights reserved.\n\nFor more information on the Apache Software Foundation, please\nsee <http://www.apache.org/>."
}