{
  "key": "shl-2.1",
  "short_name": "Solderpad Hardware License v2.1",
  "name": "Solderpad Hardware License v2.1",
  "category": "Permissive",
  "owner": "SolderPad",
  "homepage_url": "https://solderpad.org/licenses/SHL-2.1/",
  "is_exception": true,
  "spdx_license_key": "SHL-2.1",
  "ignorable_urls": [
    "http://apache.org/licenses/LICENSE-2.0",
    "https://solderpad.org/licenses/SHL-2.1/"
  ],
  "text": "Solderpad Hardware License v2.1\n\nThis license operates as a wraparound license to the Apache License Version 2.0 (the \u201cApache License\u201d) and incorporates the terms and conditions of the Apache License (which can be found here: http://apache.org/licenses/LICENSE-2.0), with the following additions and modifications. It must be read in conjunction with the Apache License. Section 1 below modifies definitions and terminology in the Apache License and Section 2 below replaces Section 2 of the Apache License. The Appendix replaces the Appendix in the Apache License. You may, at your option, choose to treat any Work released under this license as released under the Apache License (thus ignoring all sections written below entirely).\n\n1. Terminology in the Apache License is supplemented or modified as follows:\n\n\u201cAuthorship\u201d: any reference to \u2018authorship\u2019 shall be taken to read \u201cauthorship or design\u201d.\n\n\u201cCopyright owner\u201d: any reference to \u2018copyright owner\u2019 shall be taken to read \u201cRights owner\u201d.\n\n\u201cCopyright statement\u201d: the reference to \u2018copyright statement\u2019 shall be taken to read \u2018copyright or other statement pertaining to Rights\u2019.\n\nThe following new definition shall be added to the Definitions section of the Apache License:\n\n\u201cRights\u201d means copyright and any similar right including design right (whether registered or unregistered), rights in semiconductor topographies (mask works) and database rights (but excluding Patents and Trademarks).\n\nThe following definitions shall replace the corresponding definitions in the Apache License:\n\n\u201cLicense\u201d shall mean this Solderpad Hardware License version 2.1, being the terms and conditions for use, manufacture, instantiation, adaptation, reproduction, and distribution as defined by Sections 1 through 9 of this document.\n\n\u201cLicensor\u201d shall mean the owner of the Rights or entity authorized by the owner of the Rights that is granting the License.\n\n\u201cDerivative Works\u201d shall mean any work, whether in Source or Object form, that is based on (or derived from) the Work and for which the editorial revisions, annotations, elaborations, or other modifications represent, as a whole, an original work of authorship or design. For the purposes of this License, Derivative Works shall not include works that remain reversibly separable from, or merely link (or bind by name) or physically connect to or interoperate with the Work and Derivative Works thereof.\n\n\u201cObject\u201d form shall mean any form resulting from mechanical transformation or translation of a Source form or the application of a Source form to physical material, including but not limited to compiled object code, generated documentation, the instantiation of a hardware design or physical object or material and conversions to other media types, including intermediate forms such as bytecodes, FPGA bitstreams, moulds, artwork and semiconductor topographies (mask works).\n\n\u201cSource\u201d form shall mean the preferred form for making modifications, including but not limited to source code, net lists, board layouts, CAD files, documentation source, and configuration files.\n\n\u201cWork\u201d shall mean the work of authorship or design, whether in Source or Object form, made available under the License, as indicated by a notice relating to Rights that is included in or attached to the work (an example is provided in the Appendix below).\n\n2. Grant of License. Subject to the terms and conditions of this License, each Contributor hereby grants to You a perpetual, worldwide, non-exclusive, no-charge, royalty-free, irrevocable license under the Rights to reproduce, prepare Derivative Works of, make, adapt, repair, publicly display, publicly perform, sublicense, and distribute the Work and such Derivative Works in Source or Object form and do anything in relation to the Work as if the Rights did not exist.\n\nAPPENDIX\n\nCopyright [yyyy] [name of copyright owner]\nSPDX-License-Identifier: Apache-2.0 WITH SHL-2.1\n\nLicensed under the Solderpad Hardware License v 2.1 (the \u201cLicense\u201d); you may not use this file except in compliance with the License, or, at your option, the Apache License version 2.0. You may obtain a copy of the License at\n\nhttps://solderpad.org/licenses/SHL-2.1/\n\nUnless required by applicable law or agreed to in writing, any work distributed under the License is distributed on an \u201cAS IS\u201d BASIS, WITHOUT WARRANTIES OR CONDITIONS OF ANY KIND, either express or implied. See the License for the specific language governing permissions and limitations under the License."
}