{
  "key": "vostrom",
  "short_name": "VOSTROM Public License",
  "name": "VOSTROM Public License for Open Source",
  "category": "Copyleft",
  "owner": "VOSTROM",
  "homepage_url": "https://fedoraproject.org/wiki/Licensing:VOSTROM?rd=Licensing/VOSTROM",
  "spdx_license_key": "VOSTROM",
  "other_urls": [
    "https://fedoraproject.org/wiki/Licensing/VOSTROM"
  ],
  "ignorable_copyrights": [
    "Copyright (c) 2007 VOSTROM Holdings, Inc."
  ],
  "ignorable_holders": [
    "VOSTROM Holdings, Inc."
  ],
  "ignorable_emails": [
    "license@vostrom.com"
  ],
  "text": "VOSTROM Public License for Open Source\n----------\nCopyright (c) 2007 VOSTROM Holdings, Inc.\n\nThis VOSTROM Holdings, Inc. (VOSTROM) Distribution (code and documentation)\nis made available to the open source community as a public service by VOSTROM.\nContact VOSTROM at license@vostrom.com for information on other licensing\narrangements (e.g. for use in proprietary applications).\n\nUnder this license, this Distribution may be modified and the original\nversion and modified versions may be copied, distributed, publicly displayed\nand performed provided that the following conditions are met:\n\n1.  Modified versions are distributed with source code and documentation and\nwith permission for others to use any code and documentation (whether in\noriginal or modified versions) as granted under this license;\n\n2.  if modified, the source code, documentation, and user run-time elements\nshould be clearly labeled by placing an identifier of origin (such as a name,\ninitial, or other tag) after the version number;\n\n3.  users, modifiers, distributors, and others coming into possession or\nusing the Distribution in original or modified form accept the entire risk\nas to the possession, use, and performance of the Distribution;\n\n4.  this copyright management information (software identifier and version\nnumber, copyright notice and license) shall be retained in all versions of\nthe Distribution;\n\n5.  VOSTROM may make modifications to the Distribution that are\nsubstantially similar to modified versions of the Distribution, and may\nmake, use, sell, copy, distribute, publicly display, and perform such\nmodifications, including making such modifications available under this or\nother licenses, without obligation or restriction;\n\n6.  modifications incorporating code, libraries, and/or documentation subject\nto any other open source license may be made, and the resulting work may be\ndistributed under the terms of such open source license if required by that\nopen source license, but doing so will not affect this Distribution, other\nmodifications made under this license or modifications made under other\nVOSTROM licensing arrangements;\n\n7.  no permission is granted to distribute, publicly display, or publicly\nperform modifications to the Distribution made using proprietary materials\nthat cannot be released in source format under conditions of this license;\n\n8.  the name of VOSTROM may not be used in advertising or publicity\npertaining to Distribution of the software without specific, prior written\npermission.\n\nThis software is made available \"as is\", and\n\nVOSTROM DISCLAIMS ALL WARRANTIES, EXPRESS OR IMPLIED, WITH REGARD TO THIS\nSOFTWARE, INCLUDING WITHOUT LIMITATION ALL IMPLIED WARRANTIES OF\nMERCHANTABILITY AND FITNESS FOR A PARTICULAR PURPOSE, AND IN NO EVENT SHALL\nVOSTROM BE LIABLE FOR ANY SPECIAL, INDIRECT OR CONSEQUENTIAL DAMAGES OR ANY\nDAMAGES WHATSOEVER RESULTING FROM LOSS OF USE, DATA OR PROFITS, WHETHER IN AN\nACTION OF CONTRACT, TORT (INCLUDING NEGLIGENCE) OR STRICT LIABILITY, ARISING\nOUT OF OR IN CONNECTION WITH THE USE OR PERFORMANCE OF THIS SOFTWARE."
}